{
  "$schema": "https://json-schema.org/draft/2020-12/schema",
  "$id": "https://hat-im.github.io/post-cards/models/strings.schema.json",
  "title": "Postcards — UI Strings",
  "description": "post-cards/strings.json. Static UI copy for post-cards.html and create.html.",
  "type": "object",
  "required": [
    "pageTitle",
    "nav",
    "mediaFallbackText",
    "createLinkLabel",
    "create"
  ],
  "additionalProperties": false,
  "properties": {
    "pageTitle": {
      "type": "string"
    },
    "nav": {
      "type": "object",
      "required": [
        "firstAria",
        "prevAria",
        "nextAria",
        "latestAria"
      ],
      "additionalProperties": false,
      "properties": {
        "firstAria": {
          "type": "string"
        },
        "prevAria": {
          "type": "string"
        },
        "nextAria": {
          "type": "string"
        },
        "latestAria": {
          "type": "string"
        }
      }
    },
    "mediaFallbackText": {
      "type": "string"
    },
    "createLinkLabel": {
      "type": "string"
    },
    "create": {
      "type": "object",
      "required": [
        "pageHeading",
        "pageIntro",
        "mediaLabel",
        "mediaHint",
        "mediaFallbackText",
        "toLabel",
        "toPlaceholder",
        "fromLabel",
        "fromPlaceholder",
        "subjectLabel",
        "subjectPlaceholder",
        "messageLabel",
        "messagePlaceholder",
        "postscriptLabel",
        "postscriptPlaceholder",
        "locationLabel",
        "locationPlaceholder",
        "colorLabel",
        "backLinkLabel",
        "shuffleLabel",
        "downloadGifLabel",
        "downloadGifBusyLabel",
        "downloadGifSuccessLabel",
        "gifProgressPhrases"
      ],
      "additionalProperties": false,
      "properties": {
        "pageHeading": {
          "type": "string"
        },
        "pageIntro": {
          "type": "string"
        },
        "mediaLabel": {
          "type": "string"
        },
        "mediaHint": {
          "type": "string"
        },
        "mediaFallbackText": {
          "type": "string"
        },
        "toLabel": {
          "type": "string"
        },
        "toPlaceholder": {
          "type": "string"
        },
        "fromLabel": {
          "type": "string"
        },
        "fromPlaceholder": {
          "type": "string"
        },
        "subjectLabel": {
          "type": "string"
        },
        "subjectPlaceholder": {
          "type": "string"
        },
        "messageLabel": {
          "type": "string"
        },
        "messagePlaceholder": {
          "type": "string"
        },
        "postscriptLabel": {
          "type": "string"
        },
        "postscriptPlaceholder": {
          "type": "string"
        },
        "locationLabel": {
          "type": "string"
        },
        "locationPlaceholder": {
          "type": "string"
        },
        "colorLabel": {
          "type": "string"
        },
        "backLinkLabel": {
          "type": "string"
        },
        "shuffleLabel": {
          "type": "string"
        },
        "downloadGifLabel": {
          "type": "string"
        },
        "downloadGifBusyLabel": {
          "type": "string"
        },
        "downloadGifSuccessLabel": {
          "type": "string"
        },
        "gifProgressPhrases": {
          "type": "array",
          "items": {
            "type": "string"
          },
          "minItems": 1
        }
      }
    }
  }
}