{
  "pageTitle": "Postcards to Sam",
  "nav": {
    "firstAria": "First postcard",
    "prevAria": "Previous postcard",
    "nextAria": "Next postcard",
    "latestAria": "Latest postcard"
  },
  "mediaFallbackText": "Coming soon",
  "createLinkLabel": "Create",
  "create": {
    "pageHeading": "Make a postcard",
    "pageIntro": "Pick a photo, video or GIF, write a message, choose a color.",
    "mediaLabel": "Photo or video",
    "mediaHint": "Square works best.",
    "mediaFallbackText": "Choose a photo or video",
    "toLabel": "To",
    "toPlaceholder": "Sam",
    "fromLabel": "From",
    "fromPlaceholder": "Hat",
    "subjectLabel": "Subject",
    "subjectPlaceholder": "What's this one about?",
    "messageLabel": "Message",
    "messagePlaceholder": "Write a message...",
    "postscriptLabel": "P.S.",
    "postscriptPlaceholder": "Anything else?",
    "locationLabel": "Postmark location",
    "locationPlaceholder": "Somewhere Nice",
    "colorLabel": "Background color",
    "backLinkLabel": "Postcards",
    "shuffleLabel": "Shuffle stickers",
    "downloadGifLabel": "Generate GIF",
    "downloadGifBusyLabel": "Generating",
    "downloadGifSuccessLabel": "Saved!",
    "gifProgressPhrases": [
      "Gathering fibers",
      "Sorting pulp",
      "Mixing pulp",
      "Pressing sheet",
      "Lifting sheet",
      "Drying paper",
      "Cutting card",
      "Trimming edges",
      "Smoothing surface",
      "Printing design",
      "Smudging ink",
      "Printing again",
      "Choosing words",
      "Writing message",
      "Missing a word",
      "Crossing it out",
      "Starting again",
      "Dotting i's",
      "Crossing t's",
      "Signing card",
      "Writing name",
      "Adding address",
      "Checking lines",
      "Choosing stamp",
      "Dropping stamp",
      "Sticking it down",
      "Checking address",
      "Turning card",
      "Carrying it out",
      "Walking to postbox",
      "Lifting lid",
      "Dropping it in",
      "Watching it fall",
      "Sending it off"
    ]
  }
}